Variant ID,Product Handle,Title,Quantity,SKU,Number Sold,Price,Cost Price,Product Type,Vendor
26461788869,snettisham-bracelet,Snettisham Bracelet - Default Title,1,AR327,0,65,26,Fashion including jewellery,Bristol Museums Shop
26933883845,snow-globe-tutankhamun,Snow Globe Tutankhamun - Default Title,43,6541,5,3.25,1.3,Kids,Nature planet
26407733509,snow-scene-east-knoyle-church-6-christmas-cards,"Snow Scene, East Knoyle Church  6 Christmas cards - Default Title",197,BGCBRI52,0,6,2.5,Bespoke,Custom works
26407754821,sodalite-gem-chip-bracelet,Sodalite Gem Chip Bracelet - Default Title,7,,0,2,0.48,Fashion including jewellery,British Fossils
26408465733,soft-triceratops,Soft Triceratops - Default Title,-2,,3,7,2.79,Kids,Nature Planet
26407733573,sorrow-and-song-notecard,Sorrow and Song Notecard - Default Title,60,BNCBRI008,1,2.5,0.8,Bespoke,Custom works
26407733893,sorrow-and-song-postcard,Sorrow and Song Postcard - Default Title,474,BPCBRI008,6,0.7,0.21,Bespoke,Custom works
26406369541,south-bristol-through-time,South Bristol Through Time - Default Title,9,9.78145E+12,0,14.99,8.2445,Books,Heritage books
26403897925,sparkly-spinners-asst,Sparkly Spinners Asst - Default Title,211,230040,14,0.5,0.15,Kids,House Of Marbles
26406841861,spectrum-eternity-bracelet,Spectrum Eternity Bracelet by Carrie Elspeth - Default Title,1,B1150,0,15,5.99,Fashion including jewellery,Carrie Elspeth
26406841925,spectrum-eternity-bracelet-by-carrie-elspeth-b1150,Spectrum Eternity Bracelet by Carrie Elspeth - Default Title,1,B1150,0,15,5.99,Fashion including jewellery,Carrie Elspeth
26406841989,spectrum-eternity-earrings-by-carrie-elspeth-eh1150,Spectrum Eternity Earrings by Carrie Elspeth - Default Title,1,EH1150,0,12.5,4.99,Fashion including jewellery,Carrie Elspeth
26406842053,spectrum-eternity-necklace-by-carrie-elspeth-n1150,Spectrum Eternity Necklace by Carrie Elspeth - Default Title,1,N1150,0,30,9.99,Fashion including jewellery,Carrie Elspeth
26406842117,spectrum-mini-totems-earrings,Spectrum Mini Totems Earrings by Carrie Elspeth - Default Title,1,EH1137,0,15,5.99,Fashion including jewellery,Carrie Elspeth
26406842181,spectrum-mini-totems-necklace,Spectrum Mini Totems Necklace by Carrie Elspeth - Default Title,1,N1137,0,20,6.99,Fashion including jewellery,Carrie Elspeth
26406842245,spectrum-orchard-bracelet,Spectrum Orchard Bracelet by Carrie Elspeth - Default Title,1,B1261,0,12.5,4.99,Fashion including jewellery,Carrie Elspeth
26406842309,spectrum-orchard-earrings,Spectrum Orchard Earrings by Carrie Elspeth - Default Title,1,EH1261,0,12.5,3.99,Fashion including jewellery,Carrie Elspeth
26406842373,spectrum-orchard-necklace,Spectrum Orchard Necklace by Carrie Elspeth - Default Title,0,N1261,1,15,5.99,Fashion including jewellery,Carrie Elspeth
26406842437,spectrum-radiance-earrings,Spectrum Radiance Earrings by Carrie Elspeth - Default Title,1,EH1233,0,12.5,3.99,Fashion including jewellery,Carrie Elspeth
26406842501,copy-of-spectrum-teardrop-bracelet-by-carrie-elspeth,Spectrum Radiance Necklace by Carrie Elspeth - Default Title,1,N1233,0,12.5,4.99,Fashion including jewellery,Carrie Elspeth
26406842565,spectrum-radience-bracelet-b1233,Spectrum Radience Bracelet  by Carrie Elspeth - Default Title,2,,0,12.5,4.99,Fashion including jewellery,Carrie Elspeth
26406842629,spectrum-teardrop-bracelet-by-carrie-elspeth-b1165,Spectrum Teardrop Bracelet  by Carrie Elspeth - Default Title,3,B1165,0,15,5.99,Fashion including jewellery,Carrie Elspeth
26406842693,spectrum-teardrop-earrings,Spectrum Teardrop Necklace by Carrie Elspeth - Default Title,3,N1165,0,30,4.99,Fashion including jewellery,Carrie Elspeth
26408463493,spoon,Spoon - Default Title,46,,0,1,0.325,Home,Mandarin Arts
26408252613,spring-clean-card-cdp114b-3,Spring Clean Card CDP114B/3 - Default Title,13,,1,2.25,0.94,Stationary and Greeting cards,Canns Down Press Ltd
26403897989,square-puzzles,Square Puzzles - Default Title,8,230031,0,1,0.4,Kids,House Of Marbles
26406324485,squares-other-shapes,Squares & Other Shapes - Default Title,11,9.78071E+12,0,6.95,3.8225,Books,Heritage books
28132726981,squirrel-with-an-amazing-acorn-print,Squirrel with an Amazing Acorn Print - Default Title,1,,0,20,8,Prints,Melanie Wickham
26408252677,squirrels-and-saxifrage-cdp-8a-8,Squirrels and Saxifrage CDP 8A/8 - Default Title,10,,6,2.25,0.94,Stationary and Greeting cards,Canns Down Press Ltd
26408861829,squirrels-in-parkland,Squirrels in Parkland - Default Title,9,MH1293,3,2.5,0.95,Stationary and Greeting cards,Art Angels
26408252741,ss-great-britain-cdp-3a-5,SS Great Britain CDP 3A/5 - Default Title,5,,9,2.25,0.94,Stationary and Greeting cards,Canns Down Press Ltd
26406443845,st-andrew-s-park-in-snow-magnet-bp1,"St Andrew,s Park in snow magnet BP1 - Default Title",9,,2,3,1.04,Souvenirs,Star editions
26406421637,st-andrew-s-park-in-snow-postcard-bp1,"St Andrew,s Park in snow postcard BP1 - Default Title",44,,14,0.7,0.25,Stationary and Greeting cards,Star editions
26406481925,stacking-crayon,Stacking Crayon - Default Title,201,1,4,1,0.4,Stationary and Greeting cards,Emblem
28068511941,stacking-skeleton-mug-set,Stacking skeleton mug set - Default Title,2,,0,38,0,Exhibitions,Charlotte Clark
26403240069,staffordshire-hoard-bookmark,Staffordshire Hoard Bookmark - Default Title,20,,9,2,0.75,Stationary and Greeting cards,Birmingham Museum
26498385349,staffordshire-hoard-gold-cross,Staffordshire Hoard gold cross postcard - Default Title,56,,54,0.7,0.11,,Bristol Museums Shop
26403240005,staffordshire-hoard-pen,Staffordshire Hoard Pen - Default Title,22,,0,10,4,Stationary and Greeting cards,Birmingham Museum
26405923909,staffordshire-hoard-postcard-gold-collar,Staffordshire Hoard postcard Gold collar - Default Title,-1,,8,0.7,0.11,Stationary and Greeting cards,Potteries Museum & Art Gallery
26405923973,staffordshire-hoard-postcard-gold-filigree,Staffordshire Hoard postcard Gold filigree - Default Title,0,,0,0.7,0.11,Stationary and Greeting cards,Potteries Museum & Art Gallery
26405924037,staffordshire-hoard-postcard-gold-pommel,Staffordshire Hoard postcard Gold pommel - Default Title,-1,,16,0.7,0.11,Stationary and Greeting cards,Potteries Museum & Art Gallery
26405943813,staffordshire-hoard-tote-bag-cream,Staffordshire Hoard Tote Bag Cream - Default Title,10,,3,16.99,5.5,Souvenirs,Potteries Museum & Art Gallery
26406842757,star-and-turquoise-miracle-earrings,Star and Turquoise Miracle Earrings by Carrie Elspeth - Default Title,3,EE051,0,12.5,3.99,Fashion including jewellery,Carrie Elspeth
27567325189,star-fish-blue-scarf,Star Fish Blue Scarf - Default Title,3,C-3003,0,15,0,Fashion including jewellery,Weartrade
26405132229,star-xmas-decoration,Star Xmas Decoration - Default Title,2,,0,1.6,1.2,Home,Gisela Graham
26406664901,trevor-haddrell-starry-night-small-print-framed,Starry Night Small Print Framed by Trevor Haddrell - Default Title,1,THSMLSTA,1,35,23,Prints,Trevor Haddrell
26407750661,steel-ring,Steel Ring - Default Title,1,PK224,2,1,0.15,Kids,British Fossils
26493321349,stegosaurus-dinosaur-model,Stegosaurus Collecta Dinosaur Model - Default Title,11,,1,5.5,2.3,Souvenirs,Everything Dinosaur
26405039429,stegosaurus-dinosaur-dna,Stegosaurus Dinosaur DNA - Default Title,4,407004,0,14.95,6.5,Kids,Great Gizmos Limited
26408633093,stegosaurus-pin-badge-pewter,Stegosaurus Pin Badge Pewter - Default Title,0,,1,2.5,1,Fashion including jewellery,Westair
26408465797,stegosaurus-soft-large,Stegosaurus Soft Large - Default Title,29,,0,13,4.99,Kids,Nature Planet
26406324549,stick-man-1,Stick Man - Default Title,14,9.78141E+12,6,6.99,3.8445,Books,Heritage books
26406772357,stick-pin-garnet-staffordshire-hoard,Stick Pin-Garnet-Staffordshire Hoard - Default Title,4,SPS9830,0,75,31,Fashion including jewellery,Paula Bolton
26408073733,stick-umbrella-blue-strawberry-thief,Stick Umbrella Blue Strawberry Thief - Default Title,5,,0,13.75,5.5,Fashion including jewellery,AC Jade
26408073157,stick-umbrella-butterfly,Stick Umbrella Butterfly - Default Title,6,,1,13.75,5.5,Fashion including jewellery,AC Jade
26408073029,stick-umbrella-morning-garden,Stick Umbrella Morning Garden - Default Title,7,,1,13.75,5.5,Fashion including jewellery,AC Jade
26404806277,stickers-farmyard-3d,Stickers Farmyard 3D - Default Title,9,,0,1.75,0.72,Kids,Ashwood
26404806341,stickers-trains-and-trucks,Stickers Trains and Trucks and Planes - Default Title,4,,0,1.5,0.63,Stationary and Greeting cards,Ashwood
26405095941,stickers-trains-and-trucks-and-planes,Stickers Trains and Trucks and Planes - Default Title,4,,0,1.5,0.63,Stationary and Greeting cards,Ashwood
26408252805,stilt-walkers-card-cdp-68b-3,Stilt Walkers Card CDP 68B/3 - Default Title,6,,6,2.25,0.94,Stationary and Greeting cards,Canns Down Press Ltd
26407753413,stone-ring-1-50,Stone ring £1.50 - Default Title,93,,11,1.5,0.41,Souvenirs,British Fossils
26408073797,strawberry-thief-bowler-bag,Strawberry Thief Bowler Bag - Default Title,5,,0,30,12.9,Fashion including jewellery,AC Jade
26408082053,strawberry-thief-folding-hook-umberella,Strawberry Thief Folding Hook Umberella - Default Title,0,,1,15,6,Fashion including jewellery,AC Jade
26408082117,strawberry-thief-purse,Strawberry Thief Purse - Default Title,0,,1,12.5,5,Fashion including jewellery,AC Jade
26406324613,street-art-memory-game,Street Art Memory Game - Default Title,2,9.78906E+12,2,13.95,6.3965,Books,Heritage books
26403898053,stunt-kite,Stunt Kite - Default Title,1,,0,15,5.2,Kids,House Of Marbles
26406422149,sunday-morning-stillness-bp010-print,Sunday Morning Stillness BP010 Print - Default Title,12,,0,7.5,2.99,Stationary and Greeting cards,Star editions
26600696325,sunday-morning-stillness-by-peros-postcard,Sunday morning stillness by Pero's ... postcard - Default Title,75,,4,0.7,0.25,Stationary and Greeting cards,Star editions
26406422597,sunday-morning-stillness-postcard,Sunday Morning Stillness postcard BP10 - Default Title,44,,2,0.7,0.25,Stationary and Greeting cards,Star editions
26406443973,sunday-morning-stillness-postcard-bp10,Sunday Morning Stillness postcard BP10 - Default Title,39,,7,0.7,0.25,Stationary and Greeting cards,Star editions
27666377477,sunflower-bowl,Sunflower bowl - Default Title,0,BOSU,0,14.99,0,Home,Hannah Turner
27666380293,sunflower-butter-dish,Sunflower butter dish - Default Title,0,BUSU,0,32.99,0,Home,Hannah Turner
27666380165,sunflower-coasters,Sunflower coasters - Default Title,0,COSU,0,20.99,0,Home,Hannah Turner
27666379717,sunflower-dinner-plate,Sunflower dinner plate - Default Title,0,DPSU,0,29.99,0,Home,Hannah Turner
27666377413,sunflower-espresso,Sunflower espresso - Default Title,0,ECSU,0,15.99,0,Home,Hannah Turner
27666377989,sunflower-milk-jug,Sunflower milk jug - Default Title,0,CJSU,0,15.99,0,Home,Hannah Turner
27666377349,sunflower-mug,Sunflower Mug - Default Title,0,MUSU,0,13.99,0,Home,Hannah Turner
27666377541,sunflower-serving-bowl,Sunflower serving bowl - Default Title,0,SBSU,0,42.99,0,Home,Hannah Turner
27666378885,sunflower-side-plate,Sunflower side plate - Default Title,0,SPLSU,0,14.99,0,Home,Hannah Turner
27666377669,sunflower-small-jug,Sunflower small jug - Default Title,0,BJSU,0,12.99,0,Home,Hannah Turner
27666380229,sunflower-sugar-small-lidded-pot,Sunflower sugar/small lidded pot - Default Title,0,SGSU,0,18.99,0,Home,Hannah Turner
27666378181,sunflower-tall-jug,Sunflower tall jug - Default Title,0,TJSU,0,28.99,0,Home,Hannah Turner
27666377605,sunflower-teapot,Sunflower teapot - Default Title,0,TTPSU,0,34.99,0,Home,Hannah Turner
26403898117,super-bouncy-balls-asst,Super Bouncy Balls Asst - Default Title,146,230039,139,0.5,0.15,Kids,House Of Marbles
26403898181,super-disc-shooter,Super Disc shooter - Default Title,21,230047,0,2,0.3,Kids,House Of Marbles
26406324677,superworm,Superworm - Default Title,6,9.78141E+12,6,6.99,3.8445,Books,Heritage books
26406324741,book-surrealism,Surrealism Book - Default Title,7,9.78384E+12,1,8.99,4.9445,Books,Heritage books
26407756805,lens-cloth-golden-lily-william-morris,Lens Cloth Golden Lily William Morris - Default Title,14,WGWCW31,0,3,1.25,Fashion including jewellery,Custom works
26407756869,lens-cloth-strawberry-thief-william-morris,Lens Cloth Strawberry Thief William Morris - Default Title,30,WGWWWM0011,2,3,1.25,Fashion including jewellery,Custom works
26497953029,leonardo-da-vinci-the-graphic-works,Leonardo da Vinci The Graphic Works - Default Title,5,,1,12.99,7.1445,Books,Bristol Museums Shop
26407732613,les-adieux-notecard,Les Adieux Notecard - Default Title,59,BNCBRI007,1,2.5,0.8,Bespoke,Custom works
26407732869,les-adieux-postcard,Les Adieux Postcard - Default Title,293,BPCBRI007,17,0.7,0.21,Bespoke,Custom works
26408251461,letter-maker-card-75wpb,Letter Maker Card 75WPB - Default Title,8,,2,2.25,0.94,Stationary and Greeting cards,Canns Down Press Ltd
26406322373,life-in-victorian-bristol,Life in Victorian Bristol - Default Title,1,9.7819E+12,0,17.5,9.625,Books,Heritage books
26406839109,copy-of-silver-forever-earrings,Lilac Satin Hearts Earrings by Carrie Elspeth - Default Title,1,EH1271,0,12.5,3.99,Fashion including jewellery,Carrie Elspeth
26406839173,copy-of-silver-orchard-necklace-by-carrie-elspeth,Lilac Satin Hearts Necklace by Carrie Elspeth - Default Title,0,N1271,1,20,6.99,Fashion including jewellery,Carrie Elspeth
26408251525,line-of-blossom-card-cdp-26a-6,Line Of Blossom Card CDP 26A/6 - Default Title,0,,9,2.25,0.94,Stationary and Greeting cards,Canns Down Press Ltd
28133205253,line-of-hares-print,Line of Hares Print - Default Title,1,,0,20,0,Prints,Mel
28133721285,line-of-hares-print-1,Line of Hares Print - Default Title,1,,0,20,8,Prints,Melanie Wickham
26408251589,little-owl-full-moon-card-29wpa-2,Little Owl Full Moon Card 29WPA/2 - Default Title,14,,4,2.25,0.94,Stationary and Greeting cards,Canns Down Press Ltd
26406418949,llandovery-trow-print-sw003,Llandoger Trow Print SW003 - Default Title,8,,0,7.5,2.99,Stationary and Greeting cards,Star editions
26406443717,llandoger-trow-print-sw003,Llandoger Trow Print SW003 - Default Title,8,,0,7.5,2.99,Stationary and Greeting cards,Star editions
26408859845,loch-duich,Loch Duich - Default Title,0,IC1338,3,2.5,0.95,Stationary and Greeting cards,Art Angels
26406322437,look-inside-the-stone-age,Look Inside the Stone Age - Default Title,7,9.78141E+12,2,9.99,5.4945,Books,Heritage books
26408860485,lost-lanes-wales,Lost Lanes Wales - Default Title,0,AP1754,9,2.5,0.95,Stationary and Greeting cards,Art Angels
26407732933,louisa-ruth-herbert-greetings-card,Louisa Ruth Herbert Greeting Card - Default Title,294,,0,2.5,0.8,Stationary and Greeting cards,Custom works
26407756933,louisa-ruth-herbert-greeting-card,Louisa Ruth Herbert Greeting Card - Default Title,293,,1,2.5,0.8,Stationary and Greeting cards,Custom works
26406419525,lunchtime-rendezvous-park-street,Lunchtime Rendezvous Postcard BP8 - Default Title,15,1,2,0.7,0.25,Stationary and Greeting cards,Star editions
26406443781,lunchtime-rendezvous-postcard-bp8,Lunchtime Rendezvous Postcard BP8 - Default Title,11,1,6,0.7,0.25,Stationary and Greeting cards,Star editions
26403184965,mackintosh-tulip-silk-scarf,Mackintosh Tulip Silk Scarf - Default Title,0,,1,37.5,14.95,Fashion including jewellery,Fox & Chave
26406322501,mad-about-dinosaurs,Mad about Dinosaurs - Default Title,11,9.78141E+12,4,6.99,3.8445,Books,Heritage books
26406322565,mad-about-monkeys,Mad about Monkeys - Default Title,7,9.78191E+12,0,12.99,7.1445,Books,Heritage books
26408214469,made-in-bristol-mug,Made in Bristol Mug - Default Title,14,,0,5,2.5,Home,Made in Bristol (MIB)
26408094725,madonna-and-child-christmas-cards,Madonna And Child Christmas Cards - Default Title,73,,0,6,2.57,Stationary and Greeting cards,Museums and galleries
26405204869,magic-drawer,Magic Drawer - Default Title,103,230027,22,1,0.4,Kids,House Of Marbles
26407756997,magnet-daffodil-william-morris,Magnet Daffodil William Morris - Default Title,20,WOBWMO001,2,3,1.25,Stationary and Greeting cards,Custom works
26407757061,magnet-fruit-william-morris,Magnet Fruit William Morris - Default Title,2,WOBWMO012,1,3,1.25,Stationary and Greeting cards,Custom works
26407757125,magnet-golden-lily-william-morris,Magnet Golden Lily William Morris - Default Title,8,WOBWMO002,1,3,1.25,Stationary and Greeting cards,Custom works
26933887109,magnet-shaped-tutankhamun,Magnet Shaped Tutankhamun - Default Title,8,8507,4,3.75,1.45,Kids,Nature planet
26407757189,magnet-strawberry-thief-william-morris,Magnet Strawberry Thief William Morris - Default Title,38,WOBWMO011,1,3,1.25,Stationary and Greeting cards,Custom works
26933883333,magnet-t-rex-skeleton,Magnet T-Rex Skeleton - Default Title,22,4017,2,2,0.8,Kids,Nature planet
26933883397,magnet-t-rex-tooth,Magnet T-Rex Tooth - Default Title,21,4022,3,2,0.8,Kids,Nature planet
26408465605,magnet-octopus,Magnet. Octopus - Default Title,5,,3,2,0.8,Souvenirs,Nature Planet
26405204997,magnetic-fishing-game,Magnetic Fishing Game - Default Title,2,10044,0,9,3.6,Kids,House Of Marbles
26408094789,magnetic-notepad-owls,Magnetic notepad owls - Default Title,1,,0,3.25,1.75,Stationary and Greeting cards,Museums and galleries
26408251653,magnolia-tree-card-15wpa-1,Magnolia Tree Card 15WPA/1 - Default Title,10,,2,2.25,0.94,Stationary and Greeting cards,Canns Down Press Ltd
26465572677,maisy-goes-to-the-museum-book,Maisy Goes to the Museum Book - Default Title,10,9.78141E+12,1,5.99,3.2945,Books,Heritage books
26403896453,make-your-own-sock-dino,Make Your Own Sock Dino - Default Title,8,,0,6,2.4,Kids,House Of Marbles
26408465669,mammoth-magnet,Mammoth Magnet - Default Title,3,1,3,2,0.8,Souvenirs,Nature Planet
27666289285,maracas-lion-frog,Maracas Lion & Frog - Default Title,0,OTT014595,0,10,0,Kids,Online from M Shed
26403896517,marble-bag,Marble Bag - Default Title,-62,200150,99,0.5,0.4,Kids,House Of Marbles
26406839237,copy-of-cobalt-orchard-bracelet,Marble Barrelled Spaced Bracelet by Carrie Elspeth - Default Title,3,B1253,0,12.5,4.99,Fashion including jewellery,Carrie Elspeth
26407751685,marble-egg-stand-50p,Marble egg stand - Default Title,16,,1,0.5,0.2,Souvenirs,British Fossils
26406839301,marbled-barrel-spaced-necklace,Marbled Barrel Spaced Necklace by Carrie Elspeth - Default Title,1,N1253,1,15,5.99,Fashion including jewellery,Carrie Elspeth
26403896581,marbles-booklet,Marbles Booklet - Default Title,405,200100,29,0.5,0.3,Kids,House Of Marbles
26405205061,matchstick-puzzle,Matchstick Puzzle - Default Title,15,230032,3,1,0.4,Kids,House Of Marbles
26405130437,matt-gold-ribbed-ball-w-gold-glitter-lines-80mm,Matt Gold Ribbed Ball w Gold Glitter Lines 80mm - Default Title,12,1072,0,2,1.5,Home,Gisela Graham
26405130885,gold-xmas-tree-small,Matt Gold Wire Twig Tree sml  70cm - Default Title,2,40292,0,30,10.99,Home,Gisela Graham
26788075589,medium-marble-1,Medium Marble - Default Title,2815,,203,0.25,0.1,Kids,House of Marbles
26404809157,medium-tall-footed-vase,Medium Tall Footed Vase - Default Title,2,,0,65,24.17,Home,Bristol Blue Glass Company
26404809093,medium-tall-vase,Medium Tall Vase - Default Title,1,BB019,1,40,16.25,Home,Bristol Blue Glass Company
26408632133,medusas-pendant-gilt,Medusas Pendant Gilt - Default Title,5,,0,5,2,Fashion including jewellery,Westair
26408632325,medusas-pendant-pewter,Medusas Pendant Pewter - Default Title,3,,1,4.5,1.8,Fashion including jewellery,Westair
26404517957,melanie-wickham-framed-print-60,Melanie Wickham Framed Print - Default Title,1,,0,60,0.01,Prints,Melanie Wickham
26403896645,memory-match-card-game,Memory Match Card Game - Default Title,0,,1,3,1.2,Kids,House Of Marbles
26406481605,mesh-wallet-dinosaur,Mesh Wallet - Default Title,375,1,6,3,1.27,Kids,Emblem
26405234821,metal-compass,Metal Compass - Default Title,20,SC141,10,2.5,0.9,Kids,Keycraft
27563356869,metallic-boudicca-brace,Metallic Boudicca Bracelet - Default Title,2,B1324,0,15,6.99,Fashion including jewellery,Carrie Elspeth
27562988421,metallic-boudicca-necklace,Metallic Boudicca Necklace - Default Title,2,N1324,0,15,5.99,Fashion including jewellery,Carrie Elspeth
26406839365,metallic-curiosity-full-necklace-1,Metallic Curiosity Full Necklace by Carrie Elspeth - Default Title,0,,1,20,9.99,Fashion including jewellery,Carrie Elspeth
26404291589,milk-chocolate-ammonites,Milk Chocolate Ammonites - Default Title,6,,0,4.5,2.99,Food and Confectionery,Choco-rassics
26405205125,mini-art-pad,Mini Art Pad - Default Title,25,,3,1,0.35,Kids,House Of Marbles
26405205189,mini-colouring-pencils,Mini Colouring Pencils - Default Title,61,230036,5,1,0.4,Kids,House Of Marbles
26405205253,mini-construction-kits-asst,Mini Construction Kits Asst - Default Title,1,60-750,3,2,1.6,Kids,House Of Marbles
26404810117,mini-footed-bowl,Mini Footed Bowl - Default Title,-1,,2,35,13.33,Home,Bristol Blue Glass Company
26407751621,mini-fossil-chart-pack-2-50,Mini fossil chart pack £2.50 - Default Title,62,,25,2.5,1.15,Souvenirs,British Fossils
26405205317,mini-magic-art,Mini Magic Art - Default Title,54,230038,24,1,0.24,Kids,House Of Marbles
26403896965,mini-paint-set,Mini Paint Set - Default Title,1,,4,1,0.4,Kids,House Of Marbles
26403897029,mini-playing-cards,Mini Playing Cards - Default Title,41,,2,1,0.3,Kids,House Of Marbles
26407753605,soapstone-animal-2-75,Mini Soapstone Animal - Default Title,152,PK209,40,2.75,1,Souvenirs,British Fossils
26403897157,10-colour-pens-asst,Mini Ten Colour Pen - Default Title,379,230042,19,1,0.5,Kids,House Of Marbles
26403897221,mini-water-pistol-1,Mini Water Pistol - Default Title,51,,7,1,0.4,Kids,House Of Marbles
26404291461,mint-chocolate-ammonites,Mint Chocolate Ammonites - Default Title,-6,,21,4.5,2.99,Food and Confectionery,Choco-rassics
26406839429,miracle-mini-full-necklace,Miracle Mini Full Necklace by Carrie Elspeth - Default Title,1,N1284,0,20,6.99,Fashion including jewellery,Carrie Elspeth
26406839493,miracle-minis-earrings,Miracle Minis Earrings by Carrie Elspeth - Default Title,1,EH1284-1285,0,12.5,3.99,Fashion including jewellery,Carrie Elspeth
26406839557,miracle-minis-full-bracelet,Miracle Minis Full Bracelet by Carrie Elspeth - Default Title,1,B1284,0,15,5.99,Fashion including jewellery,Carrie Elspeth
26406771205,mistletoe-brooch-by-paula-bolton,Mistletoe Brooch by Paula Bolton - Default Title,1,BRPB459M,0,80,32,Fashion including jewellery,Paula Bolton
26406771525,mistletoe-pendant-by-paula-bolton,Mistletoe Pendant by Paula Bolton - Default Title,1,PPB459M,0,57,22.5,Fashion including jewellery,Paula Bolton
26405190533,morris-mix-black-silk-scarf,Mix Black Silk Scarf William Morris - Default Title,1,15,0,37.5,14.95,Fashion including jewellery,Fox & Chave
27666289221,mobile-aeroplane,Mobile Aeroplane - Default Title,0,OTT15446,0,15,0,Kids,Online from M Shed
26406322693,modern-art,Modern Art - Default Title,2,9.78384E+12,0,12.99,7.1445,Books,Heritage books
26406322757,moments-of-mindfulness-african-wisdom,Moments of Mindfulness: African Wisdom - Default Title,1,9.7805E+12,1,8.95,4.9225,Books,Heritage books
26406771589,monet-pendant-by-paula-bolton,Monet Pendant by Paula Bolton - Default Title,3,PPB016A,0,90,42,Fashion including jewellery,Paula Bolton
26403185413,silk-scarf-monet-pond-45-00,Monet Pond Silk Scarf - Default Title,1,,0,45,17.95,Fashion including jewellery,Fox & Chave
26406322821,monet-taschen,Monet Taschen - Default Title,5,9.78384E+12,1,8.99,4.9445,Books,Heritage books
26402819461,monopoly-bristol-edition,Monopoly Bristol Edition - Default Title,1,,3,25,16.96,Kids,Kayes
26407749445,mood-ring,Mood Ring - Default Title,318,PK112,78,2.25,0.52,Souvenirs,British Fossils
26408251717,moon-garden-card-cdp18b-9,Moon Garden Card CDP18B/9 - Default Title,0,,1,2.25,0.94,Stationary and Greeting cards,Canns Down Press Ltd
26405190149,morris-acanthus-chiffon-silk-scarf,Morris Acanthus Chiffon Silk Scarf - Default Title,1,,0,45,17.95,Fashion including jewellery,Fox & Chave
26405190277,morris-bourne-chiffon-silk-scarf,Morris Bourne Chiffon Silk Scarf - Default Title,1,24-100,0,45,17.95,Fashion including jewellery,Fox & Chave
26405190405,wm-golden-lily-green-silk-scarf,Morris Golden Lily Green Silk Scarf - Default Title,1,,0,37.5,14.95,Fashion including jewellery,Fox & Chave
26405190469,morris-hammersmith-chiffon-silk-scarf,Morris Hammersmith Chiffon Silk Scarf - Default Title,2,,0,45,17.95,Fashion including jewellery,Fox & Chave
26464427653,morris-tulip-scarf,Morris Tulip Scarf - Default Title,1,41656,0,37.5,14.95,Fashion including jewellery,Fox & Chave
26404083525,moths-of-the-bristol-region,Moths of the Bristol Region - Default Title,9,9.78095E+12,0,20,12.5,Books,BRERC
26405039301,mould-paint-dinosaur,Mould & Paint - Dinosaur - Default Title,0,2160,2,10,4.55,Kids,Great Gizmos Limited
26404179973,mr-grasshead,Mr Grasshead - Default Title,14,,1,5.5,1.89,Kids,Keycraft
26406322885,mr-tiger-goes-wild,Mr Tiger Goes Wild - Default Title,8,9.78145E+12,2,6.99,3.8445,Books,Heritage books
26408457477,tea-set-musicians-design-25,Musicians Design Tea Set - Default Title,3,,0,25,8.5,Home,Mandarin Arts
26406322949,myth-and-romance-mini-book,Myth and Romance Mini Book - Default Title,12,9.78071E+12,0,5.95,3.2725,Books,Heritage books
27499620485,n1w-white-with-steel-clasp,N1W White Pearl with Steel Clasp Necklace - Default Title,3,,0,50,20,Fashion including jewellery,The Real Pearl Co.
27500834117,n1waqua-pearl-with-blue-crystal,N1WAqua Pearl with Blue Crystal - Default Title,3,,0,35,14,Fashion including jewellery,The Real Pearl Co.
27524726597,n1wpl-silver-chain-and-3-pearl-drop-necklace,N1WPL Silver Chain and 3 Pearl Drop Necklace - Default Title,3,,0,50,20,Fashion including jewellery,The Real Pearl Co.
27524500741,n1wpu-pearl-and-purple-crystal-necklace,N1WPU  Pearl and Purple Crystal Necklace - Default Title,3,,0,35,14,Fashion including jewellery,The Real Pearl Co.
