Variant ID,Product Handle,Title,Quantity,SKU,Number Sold,Price,Cost Price,Product Type,Vendor
26406664965,trevor-haddrell-suspension-bridge-small-print-framed,Suspension Bridge Small Print Framed by Trevor Haddrell - Default Title,4,THSMLSUS,1,35,23,Prints,Trevor Haddrell
26406772421,swallow-brooch-by-paula-bolton,Swallow Brooch by Paula Bolton - Default Title,2,BRPS9459,0,62,31,Fashion including jewellery,Paula Bolton
26406772485,swallow-earrings-by-paula-bolton,Swallow Earrings by Paula Bolton - Default Title,3,EPS9459,1,45,18,Fashion including jewellery,Paula Bolton
26406772549,swallow-pendant-by-paula-bolton,Swallow Pendant by Paula Bolton - Default Title,2,PPS9459,0,48,25,Fashion including jewellery,Paula Bolton
26408862341,swans,Swans - Default Title,2,,0,2.5,0.95,Stationary and Greeting cards,Art Angels
27569118661,sweet-onion-white-lime,Sweet Onion - White/Lime - Default Title,3,V-3040,0,15,0,Fashion including jewellery,Weartrade
27569236933,sweet-onion-white-navy,Sweet Onion -White/Navy - Default Title,3,,0,15,0,Fashion including jewellery,Weartrade
26408252869,swings,Swings - Default Title,8,,4,2.25,0.94,Stationary and Greeting cards,Canns Down Press Ltd
26406324805,symbolism,Symbolism - Default Title,0,9.78384E+12,1,8.99,4.9445,Books,Heritage Books
26407757637,table-mats-golden-lily-set-of-4,Table Mats Golden Lily Set of 4 - Default Title,13,TSIWMO002,0,23,9.35,Home,Custom works
26407757701,table-mats-strawberry-thief-set-of-4,Table Mats Strawberry thief Set of 4 - Default Title,2,TSTWM0011,1,23,9.35,Home,Custom works
26407757765,tablemats-william-morris-daffodil,Tablemats William Morris Daffodil - Default Title,9,,0,23,9.55,Home,Custom works
26933886405,tail-dinosaur,Tail Dinosaur - Default Title,10,8306,2,4.25,1.7,Kids,Nature planet
27666376069,fish-teapot,Tall Teapot Fish - Default Title,1,TTPFS,0,34.99,14.6,Home,Hannah Turner
26403898309,tangrams,Tangrams - Default Title,33,230030,0,1,0.4,Kids,House Of Marbles
26408865157,tapestry-cushion-cover-48cm-tree-of-life,Tapestry Cushion Cover 48cm Tree Of Life + Pad - Default Title,2,TC48P,0,48,19.45,Souvenirs,Tradional Tapestries Ltd
26408865349,tapestry-cushion-cover-48cm-tree-of-life-regular,Tapestry Cushion cover 48cm Tree Of Life Regular - Tree of life Pale,1,TC48,0,36.5,14.5,Souvenirs,Tradional Tapestries Ltd
26408867717,tapestry-cushion-cover-evenlode,Tapestry Cushion Cover Evenlode - Default Title,4,,0,42.5,17.8,Souvenirs,Tradional Tapestries Ltd
26408867845,tapestry-cushion-cover-the-library-cat,Tapestry Cushion Cover The Library Cat - Default Title,1,,0,36.5,14.5,Souvenirs,Tradional Tapestries Ltd
26408867973,tapestry-cushion-cover-the-orange-tree,Tapestry Cushion Cover The Orange tree - Default Title,1,,0,42.5,17.8,Souvenirs,Tradional Tapestries Ltd
26408866053,tapestry-hanging-rod-small,Tapestry Hanging Rod Small - Default Title,4,THRS,0,32,13.1,Souvenirs,Tradional Tapestries Ltd
26405208133,tapestry-set,Tapestry Set - Default Title,2,,0,15,7,Kids,House Of Marbles
26408866693,tapestry-tree-of-life,Tapestry Tree of Life - Default Title,2,TOLR,1,125,53,Home,Tradional Tapestries Ltd
26408861957,tate-red,Tate Red - Default Title,9,PC1197,1,2.5,0.95,Stationary and Greeting cards,Art Angels
26933889157,tattoo-t-rex,Tattoo T-Rex - Default Title,44,42000,4,1,0.4,Kids,Nature planet
26933889733,tattoo-tutankhammon,Tattoo Tutankhammon - Default Title,45,42020,3,1,0.41,Kids,Nature planet
26408252933,tea-at-furlongs-cdp-23b-8,Tea At Furlongs CDP 23B/8 - Default Title,10,,2,2.25,0.94,Stationary and Greeting cards,Canns Down Press Ltd
26408252997,tea-in-venice-due-cdp-137b-1,Tea In Venice Due CDP 137B/1 - Default Title,9,,7,2.25,0.94,Stationary and Greeting cards,Canns Down Press Ltd
26408867397,tapestry-cushion-cover,Tea party medium cushion - Default Title,1,TCM,0,35,13.5,Souvenirs,Tradional Tapestries Ltd
28133021509,teeny-tiny-bridge-print,Teeny Tiny Bridge Print - Default Title,1,,0,20,8,Prints,Melanie Wickham
26493252677,temnodontosaurus-dinosaur-model,Temnodontosaurus Collecta Dinosaur Model - Default Title,1,,3,5.5,2.65,Souvenirs,Everything Dinosaur
26407733957,tennis-triptych-magnet-set-of-3,Tennis Triptych Magnet Set of 3 - Default Title,71,BMSBRI002,0,7.5,3,Souvenirs,Custom works
26407734021,tennis-triptych-notecard,Tennis Triptych Notecard - Default Title,54,BNCBRI002,0,2.5,0.8,Bespoke,Custom works
26407734085,tennis-triptych-postcard,Tennis Triptych Postcard - Default Title,284,BPCBRI002,16,0.7,0.21,Bespoke,Custom works
27666384133,textiles-apron,Textiles Apron - Default Title,0,,0,20.99,0,Home,Hannah Turner
27666384197,textiles-oven-gloves,Textiles Oven Gloves - Default Title,0,,0,23.99,0,Home,Hannah Turner
27666384069,textiles-tea-towel,Textiles Tea towel - Default Title,0,,0,10.99,0,Home,Hannah Turner
26403342853,6-chocolate-thankyou-book-selection,Thank You Chocolate Book Selection - Default Title,10,0136TY,3,4.99,2.65,Food and Confectionery,House of Dorchester
26406324869,the-age-of-elegance,The Age of Elegance - Default Title,1,9.78071E+12,0,5.95,3.2725,Books,Heritage books
26406324933,the-art-book,The Art Book - Default Title,12,9.78071E+12,0,7.95,4.3725,Books,Heritage books
26406324997,the-art-book-for-children,The Art Book for Children - Default Title,4,9.78071E+12,0,12.95,7.1225,Books,Heritage books
26406325061,the-art-game-top-trumps,The Art Game Top Trumps - Default Title,1,,0,8.95,4.9225,Stationary and Greeting cards,Heritage books
26406325125,the-art-of-aardman,The Art of Aardman - Default Title,5,9.78147E+12,0,16.99,9.344666667,Books,Heritage books
26406325189,the-arts-and-crafts-movement,THe Arts and Crafts Movement - Default Title,4,9.78071E+12,0,27.95,15.3725,Books,Heritage books
26406300933,the-banksy-q,The Banksy Q - Default Title,5,9.78191E+12,1,12,7.2,Books,Tangent Books
26406325253,the-big-book-of-bugs,The Big Book of Bugs - Default Title,2,9.7805E+12,1,12.95,7.1225,Books,Heritage books
26406325317,the-book-of-the-dog-dogs-in-art,The Book of the Dog: Dogs in Art - Default Title,4,9.78178E+12,1,12.95,7.1225,Books,Heritage Books
26406325381,the-british-museum-book-of-cats,The British Museum Book of Cats - Default Title,6,9.78071E+12,0,9.99,5.4945,Books,Heritage Books
26408095045,the-choir-christmas-card,The Choir Christmas Card - Default Title,6,,0,2.75,2.33,Stationary and Greeting cards,Museums and galleries
26406325445,the-design-book,The Design Book - Default Title,5,9.78071E+12,0,12.95,7.1225,Books,Heritage books
26406325509,william-morris-the-designs-of-5-95,The Designs of William Morris - Default Title,3,9.78071E+12,2,5.95,3.2725,Books,Heritage books
26406395973,the-dinosaur-who-couldnt-ride-a-bike,The Dinosaur Who Couldn't Ride a Bike - Default Title,2,9.78191E+12,0,0,2.7445,Books,Heritage books
26406325573,the-fashion-book,The Fashion Book - Default Title,6,9.78071E+12,3,7.95,4.3725,Books,Heritage books
26408253061,the-feathered-cup-card-4wpa-2,The Feathered Cup Card 4WPA/2 - Default Title,7,,0,2.25,0.94,Stationary and Greeting cards,Canns Down Press Ltd
26408862021,the-ferry-i,The Ferry I - Default Title,16,CC1501,2,2.5,0.95,Stationary and Greeting cards,Art Angels
26407734149,the-fisherman-and-the-syren-magnet,The Fisherman and the Syren Magnet - Default Title,11,BOBBRI009,1,3,0.9,Bespoke,Custom works
26407734277,the-fisherman-and-the-syren-notecard,The Fisherman and the Syren Notecard - Default Title,113,BNCBRI009,0,2.5,0.8,Bespoke,Custom works
26407734341,the-fisherman-and-the-syren-postcard,The Fisherman and the Syren Postcard - Default Title,91,BPCBRI009,29,0.7,0.21,Bespoke,Custom works
26406481989,the-fun-dough-box,The Fun Dough Box - Default Title,21,1,8,2.5,0.85,Kids,Emblem
26407734597,the-garden-court-card,The Garden Court Greeting Card - Default Title,126,BGCBR!51,2,2.5,0.8,Bespoke,Custom works
26407757893,the-garden-court-greeting-card,The Garden Court Greeting Card - Default Title,128,BGCBR!51,0,2.5,0.8,Bespoke,Custom works
26407757957,the-garden-court-postcard,The Garden Court Postcard - Default Title,179,BPCBRI51,21,0.7,0.21,Bespoke,Custom works
26408253445,the-greenhouse-cdp-15a-8,The Greenhouse CDP 15A/8 - Default Title,12,,0,2.25,0.94,Stationary and Greeting cards,Canns Down Press Ltd
26406325637,the-gruffalo,The Gruffalo - Default Title,5,9.78151E+12,2,6.99,3.8445,Books,Heritage books
26407735109,the-mackerel-shaw-greetings-card,The Mackerel Shaw Greetings Card - Default Title,104,,4,2.5,0.8,Stationary and Greeting cards,Custom works
26407735237,the-mackerel-shawl-magnet,The Mackerel Shawl Magnet - Default Title,2,BOBBRI003,3,3,0.9,Bespoke,Custom works
26405244549,the-mackerel-shawl,The Mackerel Shawl Mini Print - Default Title,49,PPBR04,0,5,1.75,Bespoke,King and Mcgaw
26407735301,the-mackerel-shawl-postcard,The Mackerel Shawl Postcard - Default Title,797,BPCBRI003,23,0.7,0.21,Bespoke,Custom works
26406325765,the-modern-man-guide,The Modern Man Guide - Default Title,3,9.78193E+12,0,10.99,6.0445,Books,Heritage books
26406301189,the-naked-guide-to-bristol,The Naked Guide to Bristol - Default Title,28,9.78191E+12,0,11.99,7.49,Books,Tangent Books
26408254021,beautiful-baby-card-64wpb,The New Baby Card 64WPB - Default Title,5,,7,2.25,0.94,Stationary and Greeting cards,Canns Down Press Ltd
26406325829,the-octonauts,The Octonauts - Explore the Great Big Ocean - Default Title,14,9.78001E+12,2,7.99,4.3945,Books,Heritage books
26408254597,the-owls-bore-the-farm-away-cdp-150b,The Owls Bore the Farm Away CDP 150B - Default Title,9,,3,2.25,0.94,Stationary and Greeting cards,Canns Down Press Ltd
26406325893,the-pre-raphaelites,The Pre Raphaelites - Default Title,3,9.78071E+12,1,6.95,3.8225,Books,Heritage books
26406325957,the-pre-raphelite-vision-mini-book,The pre-Raphaelite vision mini book - Default Title,7,9.78071E+12,0,5.95,3.2725,Books,Heritage books
26406326021,the-pre-raphaelites-from-rossetti-to-ruskin-14-99,The Pre-Raphaelites from Rossetti to Ruskin - Default Title,1,9.78014E+12,0,14.99,8.2445,Books,Heritage books
26406423109,the-prom-bar-bp11gc,The Prom Bar BP11GC - Default Title,50,,2,2.5,1,Stationary and Greeting cards,Star editions
26601028421,the-prom-bar-postcard,The prom bar postcard - Default Title,71,,6,0.7,0.25,Stationary and Greeting cards,Star editions
26406326085,the-slave-trade,The Slave Trade - Default Title,12,9.78075E+12,0,7.95,4.3725,Books,Heritage books
26406326149,the-slave-trade-history-files,The Slave Trade History Files - Default Title,17,9.7805E+12,2,12.95,7.1225,Books,Heritage books
26406665029,trevor-haddrell-the-ss-great-britian-small-print-framed,The ss Great Britian Small Print Framed by Trevor Haddrell - Default Title,2,THSMLSSG,0,35,23,Prints,Trevor Haddrell
26403240133,the-staffordshire-hoard,The Staffordshire Hoard Book - Default Title,298,9.78096E+12,160,5,3,Books,Birmingham Museum
26406326213,book-the-story-of-art,The Story of Art - Default Title,5,9.78071E+12,0,24.95,13.7225,Books,Heritage books
26406326277,the-story-of-bristol,The Story of Bristol - Default Title,18,9.78184E+12,2,9.99,5.4945,Books,Heritage books
26406326341,the-story-of-life,The Story of Life - Default Title,0,9.78185E+12,3,12.99,7.1445,Books,Heritage books
26406326405,the-story-of-the-world-in-100-species,The Story of the World in 100 Species - Default Title,3,9.78141E+12,2,20,11,Books,Heritage books
26408633477,the-twelve-caesar-coin-pack,The Twelve Caesar Coin Pack - Default Title,0,,1,12.5,5,Souvenirs,Westair
26406326469,the-usborne-book-of-famous-artists,The Usborne Book of Famous Artists - Default Title,5,9.78141E+12,1,9.99,5.4945,Books,Heritage books
26408255045,the-waterwheel-card-12wpb-1,The Waterwheel Card 12WPB/1 - Default Title,2,,0,2.25,0.94,Stationary and Greeting cards,Canns Down Press Ltd
26408255557,the-waterwheel-cdp-76b-1,The Waterwheel CDP 76B/1 - Default Title,9,,3,2.25,0.94,Stationary and Greeting cards,Canns Down Press Ltd
27191610181,this-book-thinks-you-are-a-scientist,This book thinks you are a scientist - Default Title,1,,4,8.95,5.39,Books,Thames and Hudson
26408256069,tims-friend-towser-card-15wpb,Tims Friend Towser Card 15WPB - Default Title,-1,,7,2.25,0.94,Stationary and Greeting cards,Canns Down Press Ltd
27666382149,toadstool-bowl,Toadstool bowl - Default Title,0,BOTS,0,14.99,0,Home,Hannah Turner
27666382661,toadstool-coasters,Toadstool coasters - Default Title,2,COTS,0,21,8.8,Home,Hannah Turner
27666381957,toadstool-espresso,Toadstool espresso - Default Title,0,ECTS,0,15.99,0,Home,Hannah Turner
27666382341,toadstool-milk-jug,Toadstool Milk Jug - Default Title,2,CJTS,0,15.99,6.7,Home,Hannah Turner
27666381893,toadstool-mug,Toadstool Mug - Default Title,4,MUTS,1,13.99,6.05,Home,Hannah Turner
27667621829,toadstool-side-plate-1,Toadstool side plate 1 - Default Title,0,SPLTS1,0,14.99,0,Home,Hannah Turner
27667622085,toadstool-side-plate-2,Toadstool side plate 2 - Default Title,0,SPLTS2,0,14.99,0,Home,Hannah Turner
27667622341,toadstool-side-plate-3,Toadstool side plate 3 - Default Title,0,SPLTS3,0,14.99,0,Home,Hannah Turner
27667622405,toadstool-side-plate-4,Toadstool side plate 4 - Default Title,0,SPLTS4,0,14.99,0,Home,Hannah Turner
27666382277,toadstool-small-jug,Toadstool small jug - Default Title,2,BJTS,0,12.99,5.4,Home,Hannah Turner
27666382533,toadstool-storage-jar,Toadstool storage jar - Default Title,0,SJTS,0,31.99,0,Home,Hannah Turner
27666382725,toadstool-sugar-pot,Toadstool sugar pot - Default Title,0,SGTS,0,18.99,0,Home,Hannah Turner
27666382405,toadstool-tall-jug,Toadstool tall jug - Default Title,2,TJTS,0,28.99,11.9,Home,Hannah Turner
27666382213,toadstool-teapot,Toadstool teapot - Default Title,1,TPTS,0,34.99,14.6,Home,Hannah Turner
26408862149,tom-cat,Tom Cat - Default Title,11,SR1552,0,2.5,0.95,Stationary and Greeting cards,Art Angels
26403898373,touring-england,Touring England - Default Title,1,10-040,0,13,5.2,Kids,House Of Marbles
26408256517,train-landscape-card-19wpa,Train Landscape Card 19WPA - Default Title,11,,5,2.25,0.94,Stationary and Greeting cards,Canns Down Press Ltd
26408082501,travel-bag-fleur-de-lis,Travel Bag Fleur de lis - Default Title,0,,1,30,12,Fashion including jewellery,AC Jade
26406206277,bee-ss,Tree Deco Bee SS - Default Title,1,Y3154-000-05,0,4.75,3.76,Home,St Nicolas
26406206853,tree-deco-chinese-dragon,Tree Deco Chinese Dragon - Default Title,14,Y2442-0000-00,0,4.5,3.2,Home,St Nicolas
26406207365,tree-deco-egypt-black-cat,Tree Deco Egypt Black Cat - Default Title,2,Y2832-OCBC-OS,0,4.5,3.15,Home,St Nicolas
26406208005,tree-deco-maroon-curl-tree-ss,Tree Deco Maroon Curl Tree SS - Default Title,14,Y2899-CMBC-OS,0,4.5,3.57,Home,St Nicolas
26406208517,tree-deco-red-cv-star-ss,Tree Deco Red CV Star SS - Default Title,4,Y1605-BRBC-05,0,4.5,3.65,Home,St Nicolas
26406209029,tree-deco-saxon-horse,Tree Deco Saxon Horse - Default Title,1,X6001-000-00,0,4.5,3.29,Home,St Nicolas
26406209477,tree-deco-star-tassel-ss,Tree Deco Star + Tassel SS - Default Title,1,Y2451-BWBC-TS,0,4.5,3.5,Home,St Nicolas
26406209989,tree-deco-white-floral-tree-ss,Tree Deco White Floral Tree SS - Default Title,8,Y2726-CWBO-OS,0,4.5,3.12,Home,St Nicolas
26406907525,trent-artist-mug-single,Trent Artist Mug Single - Default Title,2,S14730MUG1,3,5,2.49,Home,Heath McCabe
26406665157,trevor-haddrell-brandon-hill-card,Trevor Haddrell Brandon Hill Card - Default Title,9,,11,2.5,1.25,Stationary and Greeting cards,Trevor Haddrell
26406665221,trevor-haddrell-christmas-steps-card,Trevor Haddrell Christmas Steps Card - Default Title,5,,8,2.5,1.25,Stationary and Greeting cards,Trevor Haddrell
26406665285,trevor-haddrell-clifton-suspension-bridge-card,Trevor Haddrell Clifton Suspension Bridge Card - Default Title,3,,19,2.5,1.25,Stationary and Greeting cards,Trevor Haddrell
26406665349,trevor-haddrell-cranes-on-bristol-docks-card,Trevor Haddrell Cranes on Bristol Docks Card - Default Title,3,,4,2.5,1.25,Stationary and Greeting cards,Trevor Haddrell
26406665413,trevor-haddrell-dawn-on-bristol-docks-card,Trevor Haddrell Dawn on Bristol Docks Card - Default Title,7,,5,2.5,1.25,Stationary and Greeting cards,Trevor Haddrell
26406665477,trevor-haddrell-graduation-day-card,Trevor Haddrell Graduation Day Card - Default Title,2,,15,2.5,1.25,Stationary and Greeting cards,Trevor Haddrell
26406665541,trevor-haddrell-park-street-card,Trevor Haddrell Park Street Card - Default Title,6,,9,2.5,1.25,Stationary and Greeting cards,Trevor Haddrell
26406665605,trevor-haddrell-print-95-00,Trevor Haddrell print - Default Title,7,,0,95,65,Prints,Trevor Haddrell
26406665669,trevor-haddrell-snow-on-college-green-card,Trevor Haddrell Snow on College Green Card - Default Title,14,,1,2.5,1.25,Stationary and Greeting cards,Trevor Haddrell
26406665733,trevor-haddrell-snowy-day-card,Trevor Haddrell Snowy Day Card - Default Title,3,,5,2.5,1.25,Stationary and Greeting cards,Trevor Haddrell
26406665797,trevor-haddrell-starry-night-card,Trevor Haddrell Starry Night Card - Default Title,4,,6,2.5,1.25,Stationary and Greeting cards,Trevor Haddrell
26406665861,trevor-haddrell-white-hart-steps-card,Trevor Haddrell White Hart Steps Card - Default Title,6,,1,2.5,1.25,Stationary and Greeting cards,Trevor Haddrell
27666288517,trucks-london-vehicles,Trucks London Vehicles - Default Title,0,OTT07204,0,11,0,Kids,Online from M Shed
27666288453,trucks-set-of-three-first-emergency-vehicles,Trucks Set of Three First Emergency Vehicles - Default Title,0,OTT07244,0,11,0,Kids,Online from M Shed
27666288389,trucks-set-of-three-first-trucks,Trucks Set of Three First Trucks - Default Title,0,OTT07237,0,11,0,Kids,Online from M Shed
27666288325,trucks-small-cement-mixer,Trucks Small Cement Mixer - Default Title,0,OTT07251,0,6,0,Kids,Online from M Shed
27568986117,tulip-print-white-lilac,Tulip Print white/Lilac - Default Title,0,V-3080,3,15,0,Fashion including jewellery,Weartrade
26405828421,scarf-damson-v80,Tulip Scarf Damson - Default Title,2,,0,15,5.95,Fashion including jewellery,Weartrade
26408257029,tulips-2,Tulips - Default Title,11,CDP 139A/2,5,2.25,0.94,Stationary and Greeting cards,Canns Down Press Ltd
27666383237,turkey-egtu,Turkey - Default Title,0,EGTU,0,20.99,0,Home,Hannah Turner
26406326533,turner,Turner - Default Title,3,9.78071E+12,1,6.95,3.8225,Books,Heritage books
26406326597,turner-taschen,"Turner, Taschen - Default Title",7,9.78384E+12,0,8.99,4.9445,Books,Heritage Books
26406842821,turquoise-celebration-earrings,Turquoise Celebration Earrings by Carrie Elspeth - Default Title,2,EH1155b,0,12.5,3.99,Fashion including jewellery,Carrie Elspeth
26406698757,tutankhamun,Tutankhamun - Default Title,5,ES48,6,4.75,1.85,Kids,Puckator
26408324037,tutankhamun-poster,TUTANKHAMUN Poster - Default Title,3,1,0,7.95,3.31,Prints,Ankh
26408257477,two-women-in-a-garden-cdp-92a,Two Women In A Garden Card CDP 92A - Default Title,6,,10,2.25,0.94,Stationary and Greeting cards,Canns Down Press Ltd
26496485957,tyger-tyger-burning-bright,Tyger Tyger Burning Bright - Default Title,5,,0,12.99,7.1445,Books,Bristol Museums Shop
26406326661,unbuilt-bristol,Unbuilt Bristol - Default Title,2,97819082670,0,15,8.25,Books,Heritage books
26408138629,universal-stamp-worldwide,Universal Stamp Worldwide - Default Title,44,56,39,1.17,0.95,Stamps,Universal Mail
26407753093,velvet-pouch-80p,Velvet Pouch 80p - Default Title,88,,19,0.8,0.28,Souvenirs,British Fossils
26406326725,victorian-paintings,Victorian Painting - Default Title,3,9.78071E+12,0,35,19.25,Books,Heritage books
27666288261,victorian-steam-train-pull-along,Victorian Steam Train Pull Along - Default Title,0,OTT09530,0,15,0,Kids,Online from M Shed
26405208197,village-in-a-bag,Village In A Bag - Default Title,1,60-090,0,8,3.2,Kids,House Of Marbles
26408257861,village-sreet-card-mfa111f,Village Street Card MFA111F - Default Title,6,,5,2.25,0.94,Stationary and Greeting cards,Canns Down Press Ltd
26406326789,vincent-starry-night,Vincent's Starry Night - Default Title,10,9.78178E+12,0,19.95,10.9725,Books,Heritage books
26406423621,vintage-bric-a-brac-card-bp4,Vintage & Bric A Brac Card BP4 - Default Title,2,,0,2.5,1,Stationary and Greeting cards,Star editions
26406424133,vintage-bric-a-brac-bp4-print,Vintage &Bric A Brac BP4 PRINT - Default Title,10,,1,7.5,2.99,Stationary and Greeting cards,Star editions
26406424581,vintage-and-bric-and-brac-postcard,Vintage and Bric and Brac postcard - Default Title,22,,13,0.7,0.25,Stationary and Greeting cards,Star editions
28133151237,vixen-and-cubs,Vixen and  Cubs - Default Title,1,,0,20,8,Prints,Melanie Wickham
26406444037,waiting-for-the-ferry-magnet-bp15,Waiting for the Ferry Magnet BP15 - Default Title,2,,7,3,1.04,Souvenirs,Star editions
26406424645,waiting-for-the-ferry-postcard,Waiting For The Ferry Postcard BP15 - Default Title,-1,,48,0.7,0.25,Stationary and Greeting cards,Star editions
26406424709,waiting-for-the-ferry-print-bp015,Waiting for the ferry print BP015 - Default Title,10,,1,7.5,2.99,Prints,Star editions
26408862533,walking-at-beachy-head,Walking at Beachy Head - Default Title,8,,2,2.5,0.95,Stationary and Greeting cards,Art Angels
26429810117,warrior-treasures-1-in-10-go-free-ticket,Warrior Treasures '1 in 10 go free' Ticket - Default Title,-4,wtonei,0,0,0.01,Exhibitions,Warrior Treasures Exhibition Tickets
26429809797,warrior-treasures-library-flyer-free-ticket,Warrior Treasures 'Library Flyer' Free Ticket - Default Title,-4,wtlibr,0,0,0.01,Exhibitions,Warrior Treasures Exhibition Tickets
26429809989,warrior-treasures-1-off-flyer-adult-ticket,Warrior Treasures '£1 off Flyer' Adult Ticket - Default Title,-64,wtflye,17,4,0.01,Exhibitions,Warrior Treasures Exhibition Tickets
26429809861,warrior-treasures-1-off-flyer-conc-ticket,Warrior Treasures '£1 off Flyer' Conc. Ticket - Default Title,-48,wtflco,26,3,0.01,Exhibitions,Warrior Treasures Exhibition Tickets
26429810693,warrior-treasures-adult-ticket,Warrior Treasures Adult Ticket - Default Title,-7108,wtadul,1311,5,0.01,Exhibitions,Warrior Treasures Exhibition Tickets
26429810437,warrior-treasures-art-pass-discount-concession-ticket,Warrior Treasures Art Pass Discount + Concession Ticket - Default Title,-290,wtapco,90,2,0.01,Exhibitions,Warrior Treasures Exhibition Tickets
26429810565,warrior-treasures-art-pass-discount-ticket,Warrior Treasures Art Pass Discount Ticket - Default Title,-164,wtartp,12,2.5,0.01,Exhibitions,Warrior Treasures Exhibition Tickets
26429810245,warrior-treasures-carer-ticket,Warrior Treasures Carer Ticket - Default Title,-60,wtcare,12,0,0.01,Exhibitions,Warrior Treasures Exhibition Tickets
26429810373,warrior-treasures-child-ticket,Warrior Treasures Child Ticket - Default Title,-2356,wtchil,352,0,0.01,Exhibitions,Warrior Treasures Exhibition Tickets
26429810629,warrior-treasures-concession-ticket,Warrior Treasures Concession Ticket - Default Title,-5429,wtconc,947,4,0.01,Exhibitions,Warrior Treasures Exhibition Tickets
26429809413,warrior-treasures-flash-sale-half-price-adults,Warrior Treasures Flash Sale Half Price Adults - Default Title,1,,0,2.5,0.01,Exhibitions,Warrior Treasures Exhibition Tickets
26429809477,warrior-treasures-free-adult-ticket,Warrior Treasures Free Adult Ticket - Default Title,-164,,12,0,0.01,Exhibitions,Warrior Treasures Exhibition Tickets
26429810181,warrior-treasures-nmdc-ticket,Warrior Treasures NMDC Ticket - Default Title,-21,wtnmdc,5,0,0.01,Exhibitions,Warrior Treasures Exhibition Tickets
26429809541,warrior-treasure-sw-train-offer-2nd-person-free-ticket,Warrior Treasures SW Train Offer '2nd Person Free' Ticket - Default Title,-7,wtswtr,2,0,0.01,Exhibitions,Warrior Treasures Exhibition Tickets
26429809733,warrior-wednesday-offer-exhib-drink-cake,"Warrior Wednesday Offer 'Exhib, Drink & Cake' - Default Title",-56,wtwedn,28,8,0.01,Exhibitions,Warrior Treasures Exhibition Tickets
26429809605,warrior-wednesday-offer-conc-exhib-drink-cake,"Warrior Wednesday Offer Conc. 'Exhib, Drink & Cake' - Default Title",-113,wtweco,57,7,0.01,Exhibitions,Warrior Treasures Exhibition Tickets
26408862213,water-lilies,Water Lilies - Default Title,-2,MR1344,4,2.5,0.95,Stationary and Greeting cards,Art Angels
26602917445,waterloo-gun-pencil-sharpener,Waterloo gun pencil sharpener - Default Title,1,,3,3,1.25,Stationary and Greeting cards,Westair
26406326853,we-go-to-the-gallery,We go to the Gallery - Default Title,4,9.78099E+12,3,8.99,4.9445,Books,Heritage books
26406326917,westbury-on-trym-to-avonmouth,Westbury-on Trym to Avonmouth - Default Title,5,9.78145E+12,0,14.99,8.2445,Books,Heritage books
26406424837,weston-magnet-rail506,Weston Magnet Rail506 - Default Title,4,,2,3,1.04,Home,Star editions
26406424901,weston-super-mare-rail506-postcard,Weston-Super-Mare RAIL506 Postcard - Default Title,51,,5,0.7,0.25,Stationary and Greeting cards,Star editions
26603209093,westward-postcard,Westward postcard - Default Title,33,,12,0.7,0.25,Stationary and Greeting cards,Star editions
26406424965,westward-magnet-rail685,Westward! Magnet RAIL685 - Default Title,12,,0,3,1.04,Souvenirs,Star Editions
26406327045,what-makes-great-art,What Makes Great Art: 80 Masterpieces Explained - Default Title,4,9.78071E+12,6,9.99,5.4945,Books,Heritage books
26406327109,what-makes-great-design,What Makes Great Design - Default Title,9,9.78071E+12,4,9.99,5.4945,Books,Heritage books
26406327173,what-makes-photography-great,What Makes Great Photography - Default Title,7,9.78071E+12,5,9.99,5.4945,Books,Heritage books
26496568901,what-to-draw-how-to-draw-it,What To Draw How To Draw It - Default Title,5,,0,9.99,5.4945,Books,Bristol Museums Shop
26404291525,white-chocolate-ammonites,White Chocolate Ammonites - Default Title,28,,1,4.5,2.99,Food and Confectionery,Choco-rassics
26406665093,trevor-haddrell-white-har,White Hart Steps Small Print Framed by Trevor Haddrell - Default Title,0,THSMLWHI,1,35,23,Prints,Trevor Haddrell
26408258373,white-horse-and-train-card-54wpb,White Horse and Train Card 54WPB - Default Title,12,,0,2.25,0.94,Stationary and Greeting cards,Canns Down Press Ltd
