Variant ID,Product Handle,Title,Quantity,SKU,Number Sold,Price,Cost Price,Product Type,Vendor
7897481093,winter-walk-christmas-card-pack,Winter walk christmas card pack - Default Title,1,,0,5.25,0,Stationary and Greeting cards,Museums and galleries
18261069509,wm-golden-lily-green-silk-scarf,WM Golden Lily Green Silk Scarf - Default Title,1,,0,37.5,0,Fashion including jewellery,Fox & Chave
9180491845,wobbly-dinosaur-press-up,Wobbly Dinosaur Press Up - Default Title,3,222037,45,4,1.6,Kids,House Of Marbles
8830260229,wooden-ball-catch-3-75,Wooden Ball Catch £3.75 - Default Title,2,,22,3.75,1.49,Kids,Ashwood
1620549380,bracelet-wooden-1-50,Wooden Bracelet £1.50 - Default Title,33,,142,1.5,0.55,Souvenirs,British Fossils
9180376581,wooden-clockwork-train,Wooden Clockwork Train - Default Title,-9,220056,80,4,1.6,Kids,House Of Marbles
2324597508,wooden-pencil-sharpener-1-35,Wooden pencil sharpener £1.35 - Default Title,22,,2,1.35,1.98,Kids,Ashwood
18709885765,wooden-ruler-british-history,Wooden Ruler British History - Default Title,-1,,11,1.95,0.55,Stationary and Greeting cards,Westair
18709890629,wooden-ruler-natural-history,Wooden Ruler Natural History - Default Title,1,,9,1.95,0.55,Stationary and Greeting cards,Westair
9180385093,wooden-yoyo,Wooden Yoyo - Default Title,34,222004,62,1,0.4,Kids,House Of Marbles
3872654789,woodpecker-3-00,Woodpecker - Default Title,0,,49,3,1.15,Kids,Ashwood
9180640005,woodpecker-money-box,Woodpecker Money Box - Default Title,1,,0,20,8.15,Kids,House Of Marbles
21358899909,woodpecker-scarf-denim,Woodpecker Scarf Denim - Default Title,2,V-2014,6,15,0,Fashion including jewellery,Weartrade
1331588780,wooly-mamoth-living-nature,Woolly Mammoth - Living Nature £15 - Default Title,0,1,5,15,0,Kids,Keycraft
5776842181,dinosaur-collecta-woolly-mammoth-calf,Woolly Mammoth Calf Dinosaur Collecta - Default Title,-1,,31,4,1.65,Kids,Everything Dinosaur
5777090309,dinosaur-woolly-mammoth,Woolly Mammoth Large Dinosaur Collecta - Default Title,-1,6,11,20,8,Kids,Everything Dinosaur
18380242437,wow-bristol-27cm-x-18-8cm,Wow! Bristol 27cm x 18.8cm - Default Title,0,,0,24,0,Prints,Jenny Urquhart
4303961669,wpoty-print-spiral-vine-10,WPOTY Print Spiral Vine £10 - Default Title,3,,1,10,0,Prints,Natural history museum
1589356036,wrapping-paper-1-75,Wrapping Paper - Default Title,-102,,103,1,0,Stationary and Greeting cards,Bristol Museums shop
6130781445,wrapping-paper-almond-blossom,Wrapping paper. Almond blossom - Default Title,6,,6,2.25,0,Stationary and Greeting cards,Museums and galleries
6130981445,wrapping-paper-animal-lphabet,Wrapping paper. Animal alphabet - Default Title,4,,8,2.25,0,Stationary and Greeting cards,Museums and galleries
6131082181,wrapping-paper-map,Wrapping paper. Map - Default Title,9,,3,2.25,0,Stationary and Greeting cards,Museums and galleries
21752451205,x-large-dino,X Large dino - Default Title,27,,24,8.95,0,,Bristol Museums Shop
6136510725,xmas-card-3-wise-men,Xmas card 3 wise men - Default Title,0,,6,5.25,0,Stationary and Greeting cards,Museums and galleries
6124618629,xmas-card-box-of-20-bhf,Xmas card box of 20 BHF - Default Title,1,,5,10,0,Stationary and Greeting cards,Museums and galleries
9640307909,xmas-card-early-delivery,Xmas Card Early Delivery - Default Title,1,,3,3.25,0,Stationary and Greeting cards,Museums and galleries
6136441861,xmas-card-flock-of-geese,Xmas card flock of geese - Default Title,0,,6,5,0,Stationary and Greeting cards,Museums and galleries
6136586629,xmas-card-fox,Xmas card Fox... - Default Title,0,,6,5.25,0,Stationary and Greeting cards,Museums and galleries
6136291909,xmas-card-goose,Xmas card goose - Default Title,-1,,7,5,0,Stationary and Greeting cards,Museums and galleries
9640351941,xmas-card-goose-1,Xmas Card Goose - Default Title,1,,0,5,0,Stationary and Greeting cards,Museums and galleries
7897766085,blue-tits-in-the-leaf-nest,XMAS Card Pk Blue Tits in Leaf Nest - Default Title,1,,1,2.6,0.75,Stationary and Greeting cards,Museums and galleries
6136361797,xmas-card-scrooge,Xmas card scrooge - Default Title,0,,10,5,0,Stationary and Greeting cards,Museums and galleries
6137114117,xmas-card-snow-boots,Xmas card snow boots - Default Title,1,,5,5.75,0,Stationary and Greeting cards,Museums and galleries
9640327109,xmas-card-the-coming-of-father-christmas,Xmas Card The Coming Of Father Christmas - Default Title,0,,2,5.5,0,Stationary and Greeting cards,Museums and galleries
9640239493,xmas-card-under-my-umberella,Xmas Card Under My Umberella - Default Title,1,,3,5,0,Stationary and Greeting cards,Museums and galleries
6137385093,xmas-card-guardsman,Xmas card. Guardsman - Default Title,3,,3,3.25,0,Stationary and Greeting cards,Museums and galleries
6137217605,xmas-card-pudding-kitty,Xmas card. Pudding kitty - Default Title,-2,,8,2.12,0,Stationary and Greeting cards,Museums and galleries
6136963525,xmas-card-the-night-before-christmas,Xmas card. The night before Christmas. - Default Title,1,,7,2.75,0,Stationary and Greeting cards,Museums and galleries
6137315589,xmas-card-the-sun-has-closed,Xmas card. The sun has closed... - Default Title,0,,6,4.25,0,Stationary and Greeting cards,Museums and galleries
6137163909,xmas-card-xmas-tree,Xmas card. Xmas tree - Default Title,0,,6,5,0,Stationary and Greeting cards,Museums and galleries
6124717573,xmas-cards-box-of-20-combat-stress,Xmas cards box of 20 COMBAT STRESS - Default Title,0,,9,10,0,Stationary and Greeting cards,Museums and galleries
6136220805,xmas-cards-box-of-20-marie-curie,Xmas cards box of 20 Marie Curie - Default Title,1,,8,10,0,Stationary and Greeting cards,Museums and galleries
6124833413,xmas-cards-box-of-40-toys-and-games,Xmas cards box of 40 TOYS AND GAMES - Default Title,-2,,8,11.25,0,Stationary and Greeting cards,Museums and galleries
22194541509,xmas-charity-cards-snow-scene-8-cards,XMAS CHARITY Cards Snow Scene 8 cards - Default Title,0,,6,6,0,,Bristol Museums Shop
22194452357,xmas-charity-foxes-in-the-snow-5-cards,XMAS CHARITY Foxes in the snow 5 cards - Default Title,0,,6,2.5,0,,Bristol Museums Shop
22193919045,xmas-charity-journey-from-afar-5-cards,XMAS CHARITY Journey from afar 5 cards - Default Title,0,,12,5,0,,Bristol Museums Shop
22193632197,xmas-comb-a-large-stocking-8-cards,XMAS COMB A large stocking 8 cards - Default Title,4,,8,3,0,,Bristol Museums Shop
22192831685,xmas-gift-skating-scene,XMAS GIFT Skating scene - Default Title,16,,9,0.9,0,,Bristol Museums Shop
10543217861,yacht-little-box-game,Yacht. Little Box Game - Default Title,1,,6,4,1.6,Kids,House Of Marbles
3370204997,yellow-dino-magnet-2-00,Yellow Dino magnet - Default Title,3,,7,2,0.8,Souvenirs,Nature Planet
17814433925,stretchy-man,Yellow Stretchy Man - Default Title,257,PT08,605,0.5,0,Kids,Keycraft
2322676420,yo-yo-2-75,Yo yo £2.75 - Default Title,0,,20,2.75,1.04,Kids,Ashwood
1843697668,yo-yo-greetings-card-2-50,Yo-yo greetings card £2.50 - Default Title,-2,,3,2.5,0,Stationary and Greeting cards,Museums and galleries
22959912197,youre-a-star,You're A Star - Default Title,1,BB137,0,12.5,0,Fashion including jewellery,Carrie Elspeth
9180592325,zig-zag-race,Zig Zag Racer - Default Title,0,60-059,3,14,5.3,Kids,House Of Marbles
20099991173,1-book-sale-item,£1 Book Sale Item - Default Title,-38,,39,1,0,Sale,Bristol Museums Shop
20080824645,1-sale-item,£1 Sale Item - Default Title,-113,,101,1,0,Sale,Bristol Museums Shop
4755929797,gift-voucher-10-00,£10 Gift Voucher - Default Title,584,,16,10,0,Bespoke,Bristol Museums Shop
20099994309,2-book-sale-item,£2 Book Sale Item - Default Title,-8,,9,2,0,Sale,Bristol Museums Shop
20080839237,2-sale-item,£2 Sale Item - Default Title,-34,,26,2,0,Sale,Bristol Museums Shop
4755951877,gift-voucher-20-00,£20 Gift Voucher - Default Title,396,,3,20,0,Bespoke,Bristol Museums Shop
24696609989,the-architecture-of-st-mary-redcliffe,The Architecture of St Mary Redcliffe - Conc.,-3,,5,30,0,Events and Workshops,Bristol museum
24728984325,the-architecture-of-st-mary-redcliffe,The Architecture of St Mary Redcliffe - adult,0,,0,35,0,Events and Workshops,Bristol museum
5908750469,the-art-book,The art book - Default Title,2,,9,7.95,0,Books,Heritage books
5908524549,the-art-book-for-children,The art book for children - Default Title,4,,11,12.95,0,Books,Heritage books
21289260293,the-art-game-top-trumps,The Art Game Top Trumps - Default Title,5,,15,8.95,0,Stationary and Greeting cards,Heritage books
20935079877,the-art-of-aardman,The Art of Aardman - Default Title,5,9.78147E+12,10,16.99,0,Books,Heritage books
1329986588,the-art-of-ruins,The Art of Ruins - Default Title,7,Adela Breton,160,5,0,Books,Bristol Museums shop
21060112133,the-arts-and-crafts-movement,THe Arts and Crafts Movement - Default Title,2,,4,27.95,0,Books,Heritage books
17707702725,the-banksy-q,The Banksy Q - Default Title,28,,33,12,0,Books,Tangent books
20398089925,the-bfg-soft-toy-medium,The BFG Soft Toy Medium - Default Title,5,,4,15,0,Kids,Rainbow Designs
20398145669,the-bfg-soft-toy-with-sounds,The BFG Soft Toy With Sounds - Default Title,4,,0,25,0,Kids,Rainbow Designs
17039544773,the-big-book-of-bugs,The Big Book of Bugs - Default Title,3,,15,12.95,7.77,Books,Heritage books
16500275589,the-book-of-the-dog-dogs-in-art,The Book of the Dog: Dogs in Art - Default Title,7,,37,12.95,0,Books,Heritage Books
19020069893,the-bristol-and-beyond-postcard-colouring-book,The Bristol and beyond Postcard Colouring Book - Default Title,0,,31,7.99,0,Souvenirs,Emmeline Simpson
16894080773,the-british-museum-book-of-cats,The British Museum Book of Cats - Default Title,3,,25,9.99,4.99,Books,Heritage Books
22149430789,the-choir-christmas-card,The Choir Christmas Card - Default Title,6,,6,2.75,0,Stationary and Greeting cards,Museums and galleries
21290212357,the-costume-history,The Costume History - Default Title,0,,6,12.99,0,Books,Heritage books
17160594437,the-country-house-at-war,The Country House at War - Default Title,0,,2,6,3.6,Books,Heritage books
20004312133,the-deer-the-trees,The Deer & The Trees CDP 8R - Default Title,0,,24,2.25,0,Stationary and Greeting cards,Canns Down Press Ltd
22306589509,the-design-book,The Design Book - Default Title,1,,4,12.95,0,Books,Heritage books
9008690885,william-morris-the-designs-of-5-95,The Designs of William Morris - Default Title,11,,34,5.95,3.57,Books,Heritage books
9008818373,the-england-of-eric-ravilious-25-00,The England of Eric Ravilious - Default Title,0,,2,25,0,Books,Heritage books
23739706885,the-entrance-to-the-temple-in-snow,The Entrance to the Temple in Snow - Default Title,1,,0,2.25,0,Stationary and Greeting cards,Arthouse
20935557189,the-fashion-book,The Fashion Book - Default Title,0,,11,7.95,0,Books,Heritage books
16731961093,the-feathered-cup-card-4wpa-2,The Feathered Cup Card 4WPA/2 - Default Title,11,,3,2.25,0.89,Stationary and Greeting cards,Canns Down Press Ltd
17975870405,the-ferry-i,The Ferry I - Default Title,20,CC1501,10,2.5,0,Stationary and Greeting cards,Art Angels
16731963781,the-first-fence-2wpb-2,The First Fence Card 2WPB/2 - Default Title,12,,18,2.25,0.89,Stationary and Greeting cards,Canns Down Press Ltd
10936379397,the-fisherman-and-the-syren-magnet,The Fisherman and the Syren Magnet - Default Title,53,BOBBRI009,46,3,0.9,Bespoke,Custom works
10937421893,the-fisherman-and-the-syren-notecard,The Fisherman and the Syren Notecard - Default Title,145,BNCBRI009,54,2.5,0.8,Bespoke,Custom works
10936973445,the-fisherman-and-the-syren-postcard,The Fisherman and the Syren Postcard - Default Title,725,BPCBRI009,274,0.7,0.21,Bespoke,Custom works
1330195392,the-flora-of-the-bristol-region,The Flora of the Bristol Region - Default Title,1,12,7,10,0,Books,BRERC
20902528133,the-flower-basket-card-cpd155b,The Flower Basket Card CPD155B - Default Title,0,,12,2.25,0,Stationary and Greeting cards,Canns Down Press Ltd
1328215492,the-fun-dough-box,The Fun Dough Box - Default Title,33,1,266,2.5,0,Kids,Emblem
18505318469,the-garden-court-card,The Garden Court Greeting Card - Default Title,146,BGCBR!51,54,2.5,0,Bespoke,Custom works
18505071749,the-garden-court-postcard,The Garden Court Postcard - Default Title,147,BPCBRI51,253,0.7,0,Bespoke,Custom works
19782086725,the-georgian-house-sugar-trail-leaflet,The Georgian House Sugar Trail Leaflet - Default Title,48,,15,1,0,Books,Learning
16731960773,the-green-house-cylamen-and-tomatoes-1935-card-cdp15a-8,The Green House Cylamen and Tomatoes 1935 card CDP15A/8 - Default Title,-10,,16,2.25,0.89,Stationary and Greeting cards,Canns Down Press Ltd
17589025925,the-greenhouse-cdp-15a-8,The Greenhouse CDP 15A/8 - Default Title,16,,6,2.25,0,Stationary and Greeting cards,Canns Down Press Ltd
22150371781,the-gruffalo,The Gruffalo - Default Title,7,,8,6.99,0,Books,Heritage books
10468831173,the-kitchen-mug,The Kitchen Mug - Default Title,5,,1,3.75,0,Home,Star editions
7344912581,the-last-slave-market-book-8-99,The Last Slave Market - Default Title,0,,15,8.99,5.39,Books,Heritage books
17939089669,bro-the-little-book-of-bristo,The Little Book of Bristol - Default Title,0,,0,9.99,0,,History Press
16588655429,the-mackerel-shaw-greetings-card,The Mackerel Shaw Greetings Card - Default Title,27,,71,2.5,0,Stationary and Greeting cards,Custom works
10935996037,the-mackerel-shawl-magnet,The Mackerel Shawl Magnet - Default Title,139,BOBBRI003,60,3,0.9,Bespoke,Custom works
9126477125,the-mackerel-shawl,The Mackerel Shawl Mini Print - Default Title,4,PPBR04,55,5,1.75,Bespoke,King and Mcgaw
10936673925,the-mackerel-shawl-postcard,The Mackerel Shawl Postcard - Default Title,840,BPCBRI003,259,0.7,0.21,Bespoke,Custom works
23076609669,the-magpie-xmas-card-pack,The Magpie . XMAS Card Pack - Default Title,0,,1,3.99,0,Stationary and Greeting cards,Arthouse
21256265413,the-modern-man-guide,The Modern Man Guide - Default Title,3,,7,10.99,0,Books,Heritage books
3664589189,naked-guide-to-bristol-11-99,The Naked Guide to Bristol - Default Title,0,,5,11.99,7.17,Books,Tangent books
16731963141,beautiful-baby-card-64wpb,The New Baby Card 64WPB - Default Title,12,,36,2.25,0.89,Stationary and Greeting cards,Canns Down Press Ltd
17068626373,the-octonauts,The Octonauts - Explore the Great Big Ocean - Default Title,16,,34,7.99,0,Books,Heritage books
17589031173,the-owls-bore-the-farm-away-cdp-150b,The Owls Bore the Farm Away CDP 150B - Default Title,12,,28,2.25,0,Stationary and Greeting cards,Canns Down Press Ltd
1891978564,the-pool-game-greetings-card-mfa102-1,The pool game greetings card mfa102/1 - Default Title,0,,7,2.5,0.89,Stationary and Greeting cards,Canns Down Press Ltd
2522671172,the-port-of-bristol-book-12-99,The port of Bristol book £12.99 - Default Title,0,,9,12.99,6.5,Books,Heritage books
20935483205,the-pre-raphaelites,The Pre Raphaelites - Default Title,3,,2,6.95,0,Books,Heritage books
5909191301,the-pre-raphelite-vision-mini-book,The pre-Raphaelite vision mini book - Default Title,3,,18,5.95,3.57,Books,Heritage books
9009115269,the-pre-raphaelites-romance-and-realism-7-95,The Pre-Raphaelites -Romance and Realism - Default Title,0,,20,7.95,4.77,Books,Heritage books
9009173893,the-pre-raphaelites-from-rossetti-to-ruskin-14-99,The Pre-Raphaelites from Rossetti to Ruskin £14.99 - Default Title,1,,4,14.99,8.99,Books,Heritage books
17607998981,the-prom-bar-bp11-postcard,The Prom Bar BP11 Postcard - Default Title,82,,18,0.7,0,Stationary and Greeting cards,Star editions
17609301253,the-prom-bar-bp11gc,The Prom Bar BP11GC - Default Title,3,,8,2.5,0,Stationary and Greeting cards,Star editions
1395443844,the-slave-trade,The Slave Trade - Default Title,6,1,34,7.95,4.77,Books,Heritage books
17890734981,the-slave-trade-history-files,The Slave Trade History Files - Default Title,31,9.7805E+12,27,12.95,0,Books,Heritage books
21088289925,the-staffordshire-hoard,The Staffordshire Hoard Book - Default Title,129,,1056,5,0,Books,Birmingham Museum
4102181061,book-the-story-of-art,The story of Art - Default Title,5,,6,24.95,14.97,Books,Heritage books
24104048389,the-story-of-bristol,The Story of Bristol - Default Title,19,,4,9.99,0,Books,Heritage books
24173876421,the-story-of-life,The Story of Life - Default Title,3,,6,12.99,0,Books,Heritage books
24175733253,the-story-of-the-world-in-100-species,The Story of the World in 100 Species - Default Title,6,,4,20,0,Books,Heritage books
20003317637,the-sun-worshippers-cdp-5a-3,The Sun Worshippers CDP 5A/3 - Default Title,-1,CDP 5A3,7,2.25,0,Stationary and Greeting cards,Canns Down Press Ltd
4087125253,the-twelve-caesar-coin-pack-12-50,The Twelve Caesar Coin Pack £12.50 - Default Title,2,,8,12.5,5,Souvenirs,Westair
17063239557,the-usborne-book-of-famous-artists,The Usborne Book of Famous Artists - Default Title,6,,19,9.99,5.99,Books,Heritage books
1356304004,the-usborne-book-of-famous-paintings,The Usborne book of Famous Paintings - Default Title,5,1,4,12.99,0,Books,Bristol Museums shop
16731960581,the-waterwheel-card-12wpb-1,The Waterwheel Card 12WPB/1 - Default Title,-18,,37,2.25,0.89,Stationary and Greeting cards,Canns Down Press Ltd
16731959813,the-waterwheel-cdp-76b-1,The Waterwheel CDP 76B/1 - Default Title,47,,23,2.25,0.89,Stationary and Greeting cards,Canns Down Press Ltd
19810722885,this-book-thinks-youre-a-scientist,This Book Thinks You're A Scientist - Default Title,0,,13,8.95,0,Books,Heritage books
1396973124,bristol-clifton-suspension-bridge-3,Thompson24 Postcard - Default Title,1,,323,0.7,0.23,Stationary and Greeting cards,Star editions
3370166981,tiger-magnet-2-00,Tiger magnet £2.00 - Default Title,-1,,2,2,0.8,Souvenirs,nature planet
4537648517,tigers-eye-donut-necklace-3-25,Tigers Eye Donut Necklace £3.25 - Default Title,0,,5,3.25,1.3,Fashion including jewellery,British Fossils
4555656901,tigers-eye-magnet-2-00,Tigers eye magnet £2.00 - Default Title,5,,1,2,0.65,Souvenirs,British Fossils
16731963077,tims-friend-towser-card-15wpb,Tims Friend Towser Card 15WPB - Default Title,13,,48,2.25,0.89,Stationary and Greeting cards,Canns Down Press Ltd
17975870277,tom-cat,Tom Cat - Default Title,12,SR1552,18,2.5,0,Stationary and Greeting cards,Art Angels
1782614084,tommy-pin-1-95,Tommy pin £1.95 - Default Title,5,,6,1.95,0,Souvenirs,Westair
17814261893,torpedo-magnets,Torpedo Magnets - Default Title,2,SC12,189,2.5,0,Kids,Keycraft
9180538757,touring-england,Touring England - Default Title,1,10-040,35,13,5.2,Kids,House Of Marbles
16731960709,train-landscape-card-19wpa,Train Landscape Card 19WPA - Default Title,17,,41,2.25,0.89,Stationary and Greeting cards,Canns Down Press Ltd
18269905669,train-set-in-a-tin,Train Set in a Tin - Default Title,5,101221,6,10,0,Souvenirs,Apples To Pears
18709101189,trajan-coin-pendant-pewter,Trajan Coin Pendant Pewter - Default Title,1,,9,2.5,1,Fashion including jewellery,Westair
4199273541,transfer-pack-royal-banquet,Transfer pack Royal Banquet - Default Title,-2,10,3,2.7,1.06,Kids,Westair
3407628549,travel-by-train-postcard-rail213,Travel by train postcard RAIL213 - Default Title,2,,107,0.7,0.23,Stationary and Greeting cards,Star editions
20327147269,travel-fleur-de-lis,Travel Fleur de Lis - Default Title,4,,0,30,0,,Bristol Museums Shop
24691504453,treasures-and-hoards-workshop-2-conc-sat-1st-april,Treasures and Hoards Workshop Sat. 1st April - Conc,0,,1,30,0,Events and Workshops,Bristol museum
24729179525,treasures-and-hoards-workshop-2-conc-sat-1st-april,Treasures and Hoards Workshop Sat. 1st April - Adult,1,,0,35,0,Events and Workshops,Bristol museum
22861506757,bee-ss,Tree Deco Bee SS - Default Title,2,Y3154-000-05,18,4.75,0,Home,St Nicolas
23262212421,tree-deco-chinese-dragon,Tree Deco Chinese Dragon - Default Title,14,Y2442-0000-00,6,4.5,0,Home,St Nicolas
23262180165,tree-deco-egypt-black-cat,Tree Deco Egypt Black Cat - Default Title,4,Y2832-OCBC-OS,16,4.5,0,Home,St Nicolas
22861479877,tree-deco-maroon-curl-tree-ss,Tree Deco Maroon Curl Tree SS - Default Title,13,Y2899-CMBC-OS,7,4.5,0,Home,St Nicolas
22861467141,tree-deco-red-cv-star-ss,Tree Deco Red CV Star SS - Default Title,4,Y1605-BRBC-05,16,4.5,0,Home,St Nicolas
22861514693,tree-deco-saxon-horse,Tree Deco Saxon Horse - Default Title,1,X6001-000-00,19,4.5,0,Home,St Nicolas
22861485381,tree-deco-star-tassel-ss,Tree Deco Star + Tassel SS - Default Title,2,Y2451-BWBC-TS,18,4.5,0,Home,St Nicolas
22861478213,tree-deco-white-floral-tree-ss,Tree Deco White Floral Tree SS - Default Title,9,Y2726-CWBO-OS,11,4.5,0,Home,St Nicolas
9298512197,trent-artist-collection-beaker-gift-box-of-4,Trent Artist Collection Beaker (Gift Box of 4) - Default Title,5,S14730MUG4,13,20,7.96,Home,Heath McCabe
20984772037,trent-artist-mug-single,Trent Artist Mug Single - Default Title,1,S14730MUG1,0,5001,0,Gifts,Heath McCabe
24100267973,trevor-haddrell-brandon-hill-small-print-framed,Trevor Haddrell - Brandon Hill Small Print Framed - Default Title,3,THSMLBRA,1,40,0,Prints,Trevor Haddrell
24099236613,trevor-haddrell-christmas-steps-small-print-framed,Trevor Haddrell - Christmas Steps Small Print Framed - Default Title,3,THSMLCHR,1,40,0,Prints,Trevor Haddrell
24098294405,trevor-haddrell-clevedon-pier-small-print-framed,Trevor Haddrell - Clevedon Pier Small Print Framed - Default Title,3,THSMLCLE,2,35,0,Prints,Trevor Haddrell
24099331589,trevor-haddrell-cranes-small-print-framed,"Trevor Haddrell - Cranes, Bristol Docks Small Print Framed - Default Title",3,THSMLCRA,1,35,0,Prints,Trevor Haddrell
24099443589,trevor-haddrell-graduation-day-bristol-university,"Trevor Haddrell - Graduation Day, Bristol University - Default Title",4,THSMLGRA,5,40,0,Prints,Trevor Haddrell
24099594949,trevor-haddrell-park-street-small-print-framed,Trevor Haddrell - Park Street Small Print Framed - Default Title,2,THSMLPAR,5,40,0,Prints,Trevor Haddrell
24099795269,trevor-haddrell-starry-night-small-print-framed,Trevor Haddrell - Starry Night Small Print Framed - Default Title,1,THSMLSTA,1,35,0,Prints,Trevor Haddrell
24097994501,trevor-haddrell-suspension-bridge-small-print-framed,Trevor Haddrell - Suspension Bridge Small Print Framed - Default Title,6,THSMLSUS,5,35,0,Prints,Trevor Haddrell
24099040389,trevor-haddrell-the-ss-great-britian-small-print-framed,Trevor Haddrell - The ss Great Britian Small Print Framed - Default Title,2,THSMLSSG,1,35,0,Prints,Trevor Haddrell
24099839941,trevor-haddrell-white-har,Trevor Haddrell - White Hart Steps Small Print Framed - Default Title,2,THSMLWHI,0,35,0,Prints,Trevor Haddrell
3300332549,trevor-haddrell-card-coloured-3-00,Trevor Haddrell card coloured £3.00 - Default Title,-2,,7,3,1.5,Stationary and Greeting cards,Trevor Haddrell
10035823429,trevor-haddrell-greetings-card,Trevor Haddrell greetings card - Default Title,109,,849,2.5,1.25,Stationary and Greeting cards,Trevor Haddrell
1573335300,trevor-haddrell-print-40-00,Trevor Haddrell print £40.00 - Default Title,24,,37,40,26,Prints,Trevor Haddrell
1573364740,trevor-haddrell-print-65-00,Trevor Haddrell print £65.00 - Default Title,0,,1,65,0,Prints,Trevor Haddrell
1573374596,trevor-haddrell-print-95-00,Trevor Haddrell print £95.00 - Default Title,7,,19,95,65,Prints,Trevor Haddrell
9068598597,trevor-haddrell-snowy-day-card,Trevor Haddrell Snowy Day Card - Default Title,5,,6,3,1.5,Stationary and Greeting cards,Trevor Haddrell
19716528581,trevor-hadrell-print-cloudy-day,Trevor Hadrell print Cloudy Day - Default Title,1,,0,75,0,,Bristol Museums Shop
1330193516,triassic-terrors,Triassic Terrors - Default Title,2,1,15,8.99,0,Books,Bristol Museums shop
17914038469,triceratops-dino-construction-kit,Triceratops Dino Construction Kit - Default Title,-1,,11,2,0,Kids,Professor Puzzle
6102594053,dinosaur-collecta-triceratops-4-50,Triceratops Dinosaur Collecta - Default Title,-1,,45,5.5,2.35,Kids,Everything Dinosaur
16981921349,trilobite-large,Trilobite large - Default Title,0,,1,85,0,Souvenirs,British Fossils
1575059524,trilobite-flexible-medium-3-50,"Trilobite, flexible, medium,£3.50 - Default Title",1,,0,3.5,0,Souvenirs,British Fossils
7344994373,tropical-wonderland-colouring-book-9-99,Tropical Wonderland colouring book £9.99 - Default Title,1,,9,9.99,0,Books,Heritage books
8564233029,true-love-earrings-by-carrie-elspeth-eh1145,True Love Earrings by Carrie Elspeth - Default Title,1,Eh1145,0,12.5,4.99,Fashion including jewellery,Carrie Elspeth
11003330373,tulip-blue-scarf,Tulip Blue Scarf - Default Title,0,V-1080,4,15,5.95,Fashion including jewellery,Weartrade
11003423557,tulip-cream-scarf,Tulip Cream Scarf - Default Title,0,V-1080,4,15,5.95,Fashion including jewellery,Weartrade
4411063045,scarf-damson-v80,Tulip Scarf Damson V80 - Default Title,2,,14,15,5.95,Fashion including jewellery,Weartrade
17589505669,tulips-2,Tulips - Default Title,4,CDP 139A/2,28,2.25,0,Stationary and Greeting cards,Canns Down Press Ltd
24694277701,turner,Turner - Default Title,-1,,2,6.95,0,Books,Heritage books
4303405829,turner-avon-gorge-print-12-95,Turner Avon Gorge Print £12.95 - Default Title,3,,1,12.95,0,Prints,Bristol Museums Shop
4303711685,turner-cave-print-12-95,Turner Cave Print £12.95 - Default Title,13,,1,12.95,0,Prints,Bristol Museums Shop
6670852741,turner-taschen,"Turner, Taschen - Default Title",7,5,3,8.99,0,Books,Heritage Books
16567648581,turquoise-celebration-earrings,Turquoise Celebration Earrings - Default Title,3,EH1155b,0,12.5,3.99,Fashion including jewellery,Carrie Elspeth
21142525957,turtle-magnet,Turtle Magnet - Default Title,0,,2,2,0,Souvenirs,Nature Planet
1782129156,tut-mask-pendant-3-50,Tut Mask Pendant - Default Title,1,25,45,3.5,1.33,Fashion including jewellery,Westair
18708591685,tut-pendant-pewter,Tut Pendant Pewter - Default Title,0,,10,3.5,0,Fashion including jewellery,Westair
18051796869,tutankhamen-egyptian-range,Tutankhamen - Egyptian Range - Default Title,26,WOBMUS83,4,2.5,0,Kids,Custom works
1356018436,tutankhamun-pin-badge,Tutankhamun Mask Pin Badge - Default Title,-7,1,45,2.5,0.83,Fashion including jewellery,Westair
